{
  "$schema": "https://json-schema.org/draft/2020-12/schema",
  "title": "Project layer (private): one repository and Linear project",
  "description": "Stored as projects/<name>.json. The Linear project is referenced by exact name and resolved to an ID at dry-run/preflight.",
  "type": "object",
  "additionalProperties": false,
  "required": ["workspace", "linear_project", "repo", "artifact_owner", "retention", "guidance_files", "checks"],
  "properties": {
    "interface_version": {"type": "integer", "minimum": 1, "description": "The runner-project interface this profile was written for (registry/interface.json); validate-config refuses an older one with the migration steps."},
    "workspace": {"type": "string", "pattern": "^[A-Za-z0-9][A-Za-z0-9_-]*$"},
    "linear_project": {"$ref": "#/$defs/text"},
    "repo": {"$ref": "#/$defs/text"},
    "artifact_owner": {"$ref": "#/$defs/text"},
    "retention": {"$ref": "#/$defs/text"},
    "backup_status": {"$ref": "#/$defs/text"},
    "guidance_files": {"type": "array", "minItems": 1, "items": {"$ref": "#/$defs/text"}},
    "context_files": {"type": "array", "items": {"$ref": "#/$defs/text"}},
    "criterion_lint": {
      "type": "array",
      "description": "Acceptance-criterion wording this project has seen reviews read literally. The launch preflight and dry-run warn when an unclaimed issue's criterion matches a rule (case-insensitive regular expression) and does not contain its 'unless' phrase. Warnings never stop a launch.",
      "items": {
        "type": "object",
        "additionalProperties": false,
        "required": ["pattern", "message"],
        "properties": {
          "pattern": {"$ref": "#/$defs/text"},
          "message": {"$ref": "#/$defs/text"},
          "unless": {"$ref": "#/$defs/text"}
        }
      }
    },
    "contract_file": {"$ref": "#/$defs/text", "description": "Shared contract every issue follows; the intake references it by path and SHA-256 instead of inlining it."},
    "intake_mode": {"enum": ["compact"], "description": "compact: issue-specific intake with file references, the only packet the runner writes (the schema-1 full packet was retired in W-491)."},
    "identity_files": {"type": "array", "items": {"$ref": "#/$defs/text"}},
    "check_environment": {
      "type": "object",
      "propertyNames": {"type": "string", "pattern": "^[A-Za-z_][A-Za-z0-9_]*$"},
      "additionalProperties": {"type": "string"}
    },
    "checks": {"type": "array", "minItems": 1, "items": {"$ref": "#/$defs/check"}},
    "documents_read_by_tests": {"type": "array", "uniqueItems": true, "items": {"$ref": "#/$defs/text"}, "description": "fnmatch patterns (like a check's inputs, inside the worktree) of the .md and .rst files that a test or tested code reads (W-605). A changed .md or .rst file that matches none of them is inert, so an extended check of kind code whose matched changes are all inert is not run. Without the key no documentation file is inert; an empty list states that no test or tested code reads documentation. Part of the configuration fingerprint when set."},
    "schema_documentation": {"type": "array", "uniqueItems": true, "items": {"$ref": "#/$defs/text"}, "description": "fnmatch patterns (inside the worktree) of YAML JSON Schema files (.yaml or .yml) whose documentation no test of an extended check reads (3.3.2). A changed file that matches one is inert (rule schema-documentation) when both sides give the same lines once blank lines, full-line comments and the scalar values of the keywords description, title and $comment (outside property maps such as properties and $defs) are removed, so an extended check of kind code whose matched changes are all inert is not run. Tests that read description text belong in a default check, which always runs. Without the key no YAML file is inert. Part of the configuration fingerprint when set."},
    "delivery_checks": {"type": "array", "items": {"$ref": "#/$defs/delivery"}},
    "delivery_integrity": {"$ref": "#/$defs/integrity"}
  },
  "$defs": {
    "text": {"type": "string", "minLength": 1},
    "argv": {"type": "array", "minItems": 1, "items": {"$ref": "#/$defs/text"}},
    "check": {
      "type": "object",
      "additionalProperties": false,
      "required": ["name", "kind", "tier", "inputs", "cwd", "command"],
      "properties": {
        "name": {"$ref": "#/$defs/text"},
        "kind": {"enum": ["code", "docs", "presentation", "always"]},
        "tier": {"enum": ["default", "extended"]},
        "inputs": {"type": "array", "minItems": 1, "items": {"$ref": "#/$defs/text"}},
        "cwd": {"$ref": "#/$defs/text"},
        "command": {"$ref": "#/$defs/argv"},
        "allow_empty": {"type": "boolean", "description": "true: exit code 5 (pytest: no tests collected or selected) is recorded as the outcome 'empty' and counts as passing. Part of the check definition and its reuse identity."},
        "timeout_seconds": {"type": "integer", "minimum": 1, "description": "How long this check may run; default registry phases.check_timeout_seconds, at most phases.max_check_timeout_seconds. Part of the check definition and its reuse identity."},
        "environment": {"type": "object", "propertyNames": {"type": "string", "pattern": "^[A-Za-z_][A-Za-z0-9_]*$"}, "additionalProperties": {"type": "string"}, "description": "Variables for this check only, applied after the project's check_environment and the inherited environment, with ${name} substitution as there. Part of the check definition and its reuse identity (W-524)."},
        "unset_environment": {"type": "array", "uniqueItems": true, "items": {"type": "string", "pattern": "^[A-Za-z_][A-Za-z0-9_]*$"}, "description": "Variables removed from this check's environment, whether inherited or set by check_environment; a name may not also be in environment. Part of the check definition and its reuse identity (W-524)."},
        "last_issue": {"enum": ["always", "when_changed"], "description": "Extended checks only. 'always' (default): the check runs at the batch's last issue whatever changed. 'when_changed': at the last issue it runs only if a file changed since the batch's base revision matches its inputs; otherwise it is recorded as skipped."},
        "inert_changes": {"enum": ["skip", "run"], "description": "Extended checks only (W-605). 'skip' (default for kind code): the check is not run when every changed file its inputs match is inert (a .py file equal in AST without docstrings, or a .md or .rst file outside the project's documents_read_by_tests), and is recorded as skipped with 'inert'. 'run': inertness never applies, for a check whose result depends on docstrings or comments (doctest, a linter, a type checker, coverage). A check of kind docs or presentation is never skipped for inertness and may set only 'run'. Part of the check definition and its reuse identity."},
        "base_parity": {
          "type": "object",
          "additionalProperties": false,
          "required": ["outputs"],
          "description": "Run the command also in the issue's starting commit (exported with git archive outside the worktree, with the worktree's path replaced by the export's in the command and the check environment) and compare the named outputs byte for byte. The check passes when both runs pass and every output is equal. Not run by the launch baseline.",
          "properties": {
            "outputs": {"type": "array", "minItems": 1, "uniqueItems": true, "items": {"$ref": "#/$defs/text"},
                        "description": "Files the command writes: relative to cwd, or under {run_dir} (each run's own validation directory)."}
          }
        }
      }
    },
    "relpath": {"type": "string", "minLength": 1, "pattern": "^(?!/)(?!(.*/)?\\.\\.(/|$)).+$"},
    "integrity": {
      "description": "Post-delivery integrity step (no model). manifest is relative to the issue's delivery directory; file_hashes values and true_fields files are relative to the manifest's directory.",
      "type": "object",
      "additionalProperties": false,
      "required": ["manifest", "revision_field"],
      "properties": {
        "required_checks": {"type": "array", "uniqueItems": true, "items": {"$ref": "#/$defs/text"}},
        "manifest": {"$ref": "#/$defs/relpath"},
        "revision_field": {"$ref": "#/$defs/text"},
        "file_hashes": {"type": "object", "additionalProperties": {"$ref": "#/$defs/relpath"}},
        "true_fields": {
          "type": "array",
          "items": {
            "type": "object",
            "additionalProperties": false,
            "required": ["file", "field"],
            "properties": {"file": {"$ref": "#/$defs/relpath"}, "field": {"$ref": "#/$defs/text"}}
          }
        }
      }
    },
    "delivery": {
      "type": "object",
      "additionalProperties": false,
      "required": ["cwd", "command"],
      "properties": {
        "cwd": {"$ref": "#/$defs/text"},
        "command": {"$ref": "#/$defs/argv"}
      }
    }
  }
}
